id,name,model_id:id,group_id:id,perm_read,perm_write,perm_create,perm_unlink
access_agreement_read,Read access on agreement to Employees,model_agreement,base.group_user,1,0,0,0
access_agreement_full,Full access on agreement grp,model_agreement,taz-common.taz-management,1,1,1,1
access_agreement_type_read,Read access on agreement type to Employees,model_agreement_type,base.group_user,1,0,0,0
access_agreement_type_full,Full access on agreement type grp,model_agreement_type,taz-common.taz-management,1,1,1,1
access_agreement_contractor_read,Read access on agreement contractor to Employees,model_agreement_subcontractor,base.group_user,1,0,0,0
access_agreement_contractor_full,Full access on agreement contractor grp,model_agreement_subcontractor,taz-common.taz-management,1,1,1,1
access_agreement_procedure_read,Read access on agreement procedure to Employees,model_agreement_procedure,base.group_user,1,0,0,0
access_agreement_procedure_full,Full access on agreement procedure grp,model_agreement_procedure,taz-common.taz-management,1,1,1,1
